{
  "code": "XX0002",
  "titel": "Beispiel: Numerische Strömungsmechanik",
  "cp": 6,
  "kategorien": [
    "K",
    "F"
  ],
  "tags": [
    "cfd"
  ],
  "turnus": "WS",
  "sprache": "EN",
  "leitung": "Dr. Muster",
  "kurzbeschreibung": "Erfundenes Modul. Finite-Volumen-Verfahren, Stabilität, Validierung von CFD-Rechnungen.",
  "pruefung": "mündlich, 30 min",
  "links": {
    "modul": "https://example.org/modul/XX0002",
    "lehrveranstaltungen": [
      {
        "semester": "WS 26/27",
        "url": "https://example.org/lv/XX0002-ws2627"
      }
    ]
  },
  "angebot": [
    {
      "semester": "WS 26/27",
      "status": "bestaetigt"
    }
  ],
  "notenspiegel": [
    {
      "termin": "FA 25W",
      "semester": "WS 25/26",
      "pruefungsdatum": null,
      "verteilung": {
        "1.0": 5,
        "1.3": 6,
        "1.7": 5,
        "2.0": 3,
        "2.3": 2,
        "2.7": 1,
        "3.0": 1
      },
      "nichtErschienen": 0,
      "erfasstAm": "2026-10-01",
      "quelle": "erfunden"
    }
  ],
  "stand": "2026-10-07"
}
