{
  "code": "XX0006",
  "titel": "Beispiel: Raumfahrt kompakt",
  "cp": 3,
  "kategorien": [
    "IE"
  ],
  "tags": [
    "luftraum"
  ],
  "turnus": "SS",
  "sprache": "EN",
  "kurzbeschreibung": "Erfundenes Ergänzungsfach.",
  "stand": "2026-10-07",
  "notenspiegel": [
    {
      "termin": "FA 25S",
      "semester": "SS 25",
      "pruefungsdatum": null,
      "verteilung": {
        "1.0": 5,
        "1.3": 4,
        "1.7": 2,
        "2.0": 1
      },
      "nichtErschienen": 2,
      "erfasstAm": "2026-10-01",
      "quelle": "erfunden"
    }
  ]
}
