{
  "code": "XX0001",
  "titel": "Beispiel: Grenzschichten und Reibung",
  "titelEn": "Example: Boundary Layers",
  "cp": 5,
  "kategorien": [
    "K"
  ],
  "tags": [
    "stroem",
    "aero"
  ],
  "turnus": "WS",
  "sprache": "DE",
  "leitung": "Prof. Beispiel",
  "kurzbeschreibung": "Erfundenes Modul. Laminare und turbulente Grenzschichten, Ähnlichkeitslösungen und Reibungswiderstand.",
  "pruefung": "schriftlich, 90 min",
  "links": {
    "modul": "https://example.org/modul/XX0001",
    "lehrveranstaltungen": [
      {
        "semester": "WS 26/27",
        "url": "https://example.org/lv/XX0001-ws2627"
      }
    ]
  },
  "angebot": [
    {
      "semester": "WS 26/27",
      "status": "bestaetigt"
    }
  ],
  "notenspiegel": [
    {
      "termin": "FA 24W",
      "semester": "WS 24/25",
      "pruefungsdatum": null,
      "verteilung": {
        "1.0": 2,
        "1.3": 3,
        "1.7": 4,
        "2.0": 6,
        "2.3": 5,
        "2.7": 4,
        "3.0": 3,
        "3.3": 2,
        "3.7": 2,
        "4.0": 1,
        "4.3": 1,
        "4.7": 1,
        "5.0": 6
      },
      "nichtErschienen": 5,
      "erfasstAm": "2026-10-01",
      "quelle": "erfunden"
    },
    {
      "termin": "FA 25S",
      "semester": "SS 25",
      "pruefungsdatum": null,
      "verteilung": {
        "1.7": 1,
        "2.0": 1,
        "2.3": 2,
        "2.7": 2,
        "3.0": 1,
        "3.7": 2,
        "4.0": 1,
        "5.0": 3
      },
      "nichtErschienen": 2,
      "erfasstAm": "2026-10-01",
      "quelle": "erfunden"
    },
    {
      "termin": "FA 25W",
      "semester": "WS 25/26",
      "pruefungsdatum": null,
      "verteilung": {
        "1.0": 3,
        "1.3": 4,
        "1.7": 6,
        "2.0": 7,
        "2.3": 5,
        "2.7": 3,
        "3.0": 2,
        "3.3": 2,
        "3.7": 1,
        "4.0": 1,
        "5.0": 3
      },
      "nichtErschienen": 4,
      "erfasstAm": "2026-10-01",
      "quelle": "erfunden"
    }
  ],
  "kommentare": [
    {
      "text": "Erfundener Kommentar: Altklausuren rechnen lohnt sich.",
      "datum": "2026-07-27",
      "von": "anonym"
    }
  ],
  "stand": "2026-10-07"
}
