{
  "code": "XX0003",
  "titel": "Beispiel: Kompressible Strömungen",
  "cp": 5,
  "kategorien": [
    "G"
  ],
  "tags": [
    "stroem",
    "aero"
  ],
  "turnus": "SS",
  "sprache": "EN",
  "leitung": "Prof. Beispiel",
  "kurzbeschreibung": "Erfundenes Modul. Verdichtungsstöße, Düsenströmungen, Blockage.",
  "pruefung": "schriftlich, 120 min",
  "links": {
    "modul": "https://example.org/modul/XX0003"
  },
  "angebot": [
    {
      "semester": "SS 27",
      "status": "erwartet"
    }
  ],
  "notenspiegel": [
    {
      "termin": "FA 25S",
      "semester": "SS 25",
      "pruefungsdatum": null,
      "verteilung": {
        "1.0": 1,
        "1.3": 2,
        "1.7": 5,
        "2.0": 8,
        "2.3": 9,
        "2.7": 7,
        "3.0": 5,
        "3.3": 4,
        "3.7": 3,
        "4.0": 2,
        "4.3": 2,
        "4.7": 1,
        "5.0": 9
      },
      "nichtErschienen": 11,
      "erfasstAm": "2026-10-01",
      "quelle": "erfunden"
    },
    {
      "termin": "FA 25W",
      "semester": "WS 25/26",
      "pruefungsdatum": null,
      "verteilung": {
        "2.0": 1,
        "2.7": 2,
        "3.3": 2,
        "4.0": 3,
        "5.0": 4
      },
      "nichtErschienen": 3,
      "erfasstAm": "2026-10-01",
      "quelle": "erfunden"
    }
  ],
  "stand": "2026-10-07"
}
